{
  "schemaVersion": "1.0",
  "id": "navigation-data",
  "title": "Navigation, tables, dashboards",
  "category": "patterns",
  "summary": "Navigation, tables, dashboards operational rules curated for Zanker. Independent synthesis; consult primary sources for exact normative requirements.",
  "updatedAt": "2026-10-12",
  "sources": [
    {
      "name": "NNG",
      "url": "https://www.nngroup.com/articles/ten-usability-heuristics/",
      "verifiedAt": null
    }
  ],
  "rules": [
    {
      "id": "navigation-data.table-scanning",
      "title": "Data table scanning",
      "intent": "Use alignment, sorting and meaningful grouping for expert decisions",
      "tags": [
        "navigation",
        "data.table",
        "scanning"
      ],
      "principles": [
        "Use alignment, sorting and meaningful grouping for expert decisions"
      ],
      "antiPatterns": [
        "Decorative cards replacing every dense table"
      ],
      "acceptance": [
        "Main comparisons remain scan-friendly"
      ],
      "sources": [
        {
          "name": "NNG",
          "url": "https://www.nngroup.com/articles/ten-usability-heuristics/",
          "kind": "official-or-primary",
          "verifiedAt": null
        }
      ],
      "evidenceLevel": "derived-guidance-not-verbatim"
    },
    {
      "id": "navigation-data.empty-state-action",
      "title": "Useful empty state",
      "intent": "Explain why there is no content and offer next step when appropriate",
      "tags": [
        "navigation",
        "data.empty",
        "state",
        "action"
      ],
      "principles": [
        "Explain why there is no content and offer next step when appropriate"
      ],
      "antiPatterns": [
        "Empty blank viewport with no guidance"
      ],
      "acceptance": [
        "Empty fixture has a coherent message"
      ],
      "sources": [
        {
          "name": "NNG",
          "url": "https://www.nngroup.com/articles/ten-usability-heuristics/",
          "kind": "official-or-primary",
          "verifiedAt": null
        }
      ],
      "evidenceLevel": "derived-guidance-not-verbatim"
    },
    {
      "id": "navigation-data.filters-state",
      "title": "Filter and sorting state",
      "intent": "Make active constraints visible and reversible",
      "tags": [
        "navigation",
        "data.filters",
        "state"
      ],
      "principles": [
        "Make active constraints visible and reversible"
      ],
      "antiPatterns": [
        "Hidden sticky filters producing surprising results"
      ],
      "acceptance": [
        "Clear/reset affordance available"
      ],
      "sources": [
        {
          "name": "NNG",
          "url": "https://www.nngroup.com/articles/ten-usability-heuristics/",
          "kind": "official-or-primary",
          "verifiedAt": null
        }
      ],
      "evidenceLevel": "derived-guidance-not-verbatim"
    },
    {
      "id": "navigation-data.dashboard-priority",
      "title": "Task-driven dashboards",
      "intent": "Prioritize decision-ready information over vanity metrics",
      "tags": [
        "navigation",
        "data.dashboard",
        "priority"
      ],
      "principles": [
        "Prioritize decision-ready information over vanity metrics"
      ],
      "antiPatterns": [
        "Lots of charts without next steps"
      ],
      "acceptance": [
        "Each critical chart has a question it answers"
      ],
      "sources": [
        {
          "name": "NNG",
          "url": "https://www.nngroup.com/articles/ten-usability-heuristics/",
          "kind": "official-or-primary",
          "verifiedAt": null
        }
      ],
      "evidenceLevel": "derived-guidance-not-verbatim"
    },
    {
      "id": "navigation-data.navigation-affordance",
      "title": "Navigation affordance",
      "intent": "Distinguish links, actions and selections clearly",
      "tags": [
        "navigation",
        "data.navigation",
        "affordance"
      ],
      "principles": [
        "Distinguish links, actions and selections clearly"
      ],
      "antiPatterns": [
        "Text visually identical to clickable controls"
      ],
      "acceptance": [
        "Interactive affordances perceivable"
      ],
      "sources": [
        {
          "name": "NNG",
          "url": "https://www.nngroup.com/articles/ten-usability-heuristics/",
          "kind": "official-or-primary",
          "verifiedAt": null
        }
      ],
      "evidenceLevel": "derived-guidance-not-verbatim"
    },
    {
      "id": "navigation-data.semantic-icons",
      "title": "Icon and label alignment",
      "intent": "Use stable icon meanings supported by text when ambiguous",
      "tags": [
        "navigation",
        "data.semantic",
        "icons"
      ],
      "principles": [
        "Use stable icon meanings supported by text when ambiguous"
      ],
      "antiPatterns": [
        "Swapping arbitrary icons purely for variety"
      ],
      "acceptance": [
        "Navigation labels and icons tested for clarity"
      ],
      "sources": [
        {
          "name": "NNG",
          "url": "https://www.nngroup.com/articles/ten-usability-heuristics/",
          "kind": "official-or-primary",
          "verifiedAt": null
        }
      ],
      "evidenceLevel": "derived-guidance-not-verbatim"
    }
  ]
}
